{
  "schema": "doc-reviewer/envelope@1",
  "requestId": "example-html-1",
  "doc": {
    "id": "review-essay",
    "title": "Why review matters",
    "format": "html",
    "revision": 2,
    "content": "<h1>Why review matters</h1>\n<p>Reviewing a change is harder than making one. A diff shows what moved, but not whether it should have.</p>\n<blockquote>Every edit is a claim about the reader.</blockquote>\n<p>So a reviewer does two jobs at once: check the facts, and judge the prose.</p>\n<ul>\n  <li>Check the facts</li>\n  <li>Judge the prose</li>\n</ul>\n"
  },
  "proposal": {
    "kind": "replace",
    "summary": "Tightened the opening paragraph, made the blockquote concrete, and added a third review duty.",
    "rationale": "The opening was abstract, and the list under-represented the work.",
    "content": "<h1>Why review matters</h1>\n<p>Reviewing a change is harder than making one. A diff shows what moved, but never whether it should have moved at all.</p>\n<blockquote>Every edit is a claim about a reader who is not in the room.</blockquote>\n<p>So a reviewer does two jobs at once: check the facts, and judge the prose.</p>\n<ul>\n  <li>Check the facts</li>\n  <li>Judge the prose</li>\n  <li>Say what is missing</li>\n</ul>\n"
  },
  "options": {
    "allowDirectEdit": true
  }
}
